{
  "$schema": "https://json-schema.org/draft/2020-12/schema",
  "title": "Week Manifest",
  "type": "object",
  "additionalProperties": false,
  "required": [
    "week_id",
    "module_id",
    "week_number",
    "title",
    "summary",
    "essential_question",
    "professional_context",
    "language_focus",
    "skill_focus",
    "target_vocabulary_groups",
    "grammar_focus",
    "pronunciation_focus",
    "cefr_access_level",
    "cefr_target_level",
    "estimated_total_minutes",
    "activity_ids",
    "asset_ids",
    "teacher_preparation",
    "student_deliverables"
  ],
  "properties": {
    "week_id": {
      "type": "string",
      "pattern": "^m[0-9]{2}w[0-9]{2}$"
    },
    "module_id": {
      "type": "string",
      "pattern": "^module-[0-9]{2}$"
    },
    "week_number": {
      "type": "number"
    },
    "title": {
      "type": "string"
    },
    "summary": {
      "type": "string"
    },
    "essential_question": {
      "type": "string"
    },
    "professional_context": {
      "type": "string"
    },
    "language_focus": {
      "type": "array",
      "items": {
        "type": "string"
      }
    },
    "skill_focus": {
      "type": "array",
      "items": {
        "type": "string"
      }
    },
    "target_vocabulary_groups": {
      "type": "array",
      "items": {
        "type": "string"
      }
    },
    "grammar_focus": {
      "type": "array",
      "items": {
        "type": "string"
      }
    },
    "pronunciation_focus": {
      "type": "array",
      "items": {
        "type": "string"
      }
    },
    "cefr_access_level": {
      "type": "string",
      "enum": [
        "A1",
        "A2",
        "B1",
        "B2",
        "C1"
      ]
    },
    "cefr_target_level": {
      "type": "string",
      "enum": [
        "A1",
        "A2",
        "B1",
        "B2",
        "C1"
      ]
    },
    "estimated_total_minutes": {
      "type": "number"
    },
    "activity_ids": {
      "type": "array",
      "items": {
        "type": "string",
        "pattern": "^m[0-9]{2}w[0-9]{2}-a[0-9]{2}$"
      }
    },
    "asset_ids": {
      "type": "array",
      "items": {
        "type": "string",
        "pattern": "^m[0-9]{2}w[0-9]{2}-(img|aud|pdf)-[0-9]{3}$"
      }
    },
    "teacher_preparation": {
      "type": "array",
      "items": {
        "type": "string"
      }
    },
    "student_deliverables": {
      "type": "array",
      "items": {
        "type": "string"
      }
    }
  }
}
