{
  "week_id": "m01w06",
  "module_id": "module-01",
  "week_number": 6,
  "title": "Color, Shape, and Line",
  "summary": "Students learn beginner-friendly English for color, palette, shape, line, silhouette, and overall visual impression so they can describe a look, sketch, or fashion figure respectfully and clearly.",
  "essential_question": "How can I describe what a fashion look looks like visually in simple English?",
  "professional_context": "Week 6 connects English to early fashion drawing, creativity-lab observation, look description, and beginner portfolio-style language. Students move from naming garments and figure parts to describing visual elements such as color palette, silhouette, lines, shape, and overall impression.",
  "language_focus": [
    "basic colors and color families",
    "palette language",
    "shape and line vocabulary",
    "silhouette and garment-shape words",
    "The color is ...",
    "The palette is ...",
    "The silhouette is ...",
    "The lines are ...",
    "The look has ...",
    "adjective order in simple garment phrases",
    "guided look-description writing",
    "teacher-supported visual-description speaking"
  ],
  "skill_focus": [
    "reading",
    "listening",
    "writing",
    "vocabulary",
    "speaking",
    "professional_communication",
    "visual_literacy",
    "grammar"
  ],
  "target_vocabulary_groups": [
    "m01w06-vg01",
    "m01w06-vg02",
    "m01w06-vg03",
    "m01w06-vg04",
    "m01w06-vg05"
  ],
  "grammar_focus": [
    "The color is ...",
    "The palette is ...",
    "The silhouette is ...",
    "The lines are ...",
    "The shape is ...",
    "The look has ...",
    "This look is ...",
    "I notice ...",
    "I like the ... because ...",
    "adjective order in phrases such as a long black dress and a soft pink blouse",
    "singular and plural agreement in The dress is ... and The pants are ..."
  ],
  "pronunciation_focus": [
    "palette",
    "contrast",
    "silhouette",
    "straight",
    "curved",
    "diagonal",
    "neutral",
    "oversized",
    "cropped",
    "fitted"
  ],
  "cefr_access_level": "A2",
  "cefr_target_level": "A2",
  "estimated_total_minutes": 143,
  "activity_ids": [
    "m01w06-a01",
    "m01w06-a02",
    "m01w06-a03",
    "m01w06-a04",
    "m01w06-a05",
    "m01w06-a06",
    "m01w06-a07",
    "m01w06-a08",
    "m01w06-a09"
  ],
  "asset_ids": [
    "m01w06-img-001",
    "m01w06-img-002",
    "m01w06-img-003",
    "m01w06-img-004",
    "m01w06-img-005",
    "m01w06-aud-001"
  ],
  "teacher_preparation": [
    "Preview the opener multi-look board, the color and palette board, the shape-line-silhouette board, the reading gallery, and the four-look gallery before class.",
    "Prepare visible sentence frames for The color is ..., The palette is ..., The silhouette is ..., The lines are ..., The look has ..., and I like the ... because ....",
    "Review Week 6 correction targets, especially adjective order, plural agreement with pants and shorts, and The color palette is ... .",
    "Decide whether students will choose their look for the main writing task from a projected gallery, printed cards, or a future app gallery.",
    "Keep the Week 6 listening audio or teacher read-aloud fallback aligned to the same image A-D gallery used in listening, writing, and speaking."
  ],
  "student_deliverables": [
    "Completion of the Week 6 visual opener.",
    "Completion of the main color and palette matching set.",
    "Completion of the main shape-line-silhouette matching set.",
    "Reading-comprehension responses matching three look descriptions to image A, B, or C and answering detail questions.",
    "Listening-comprehension responses identifying four looks from one audio clip.",
    "Completion of adjective-order and look-description phrase-practice frames.",
    "A scaffolded Color and Shape Look Description with 6 required sentence-frame lines and 1 optional challenge sentence.",
    "One corrected Week 6 sentence saved after review.",
    "A short teacher-observed oral look description using prepared sentence frames."
  ]
}
