{
  "week_id": "m01w05",
  "module_id": "module-01",
  "week_number": 5,
  "title": "Body, Figure, and Observation Drawing",
  "summary": "Students move from garment-only language into fashion-figure observation language. They learn body-reference points, figure and croquis vocabulary, pose and view language, and short respectful description frames for fashion figures, silhouettes, and visible garment features.",
  "essential_question": "How can I describe a fashion figure, pose, and sketch clearly in simple English for Fashion Design study?",
  "professional_context": "Week 5 connects English to observation drawing, fashion figure work, croquis reading, and beginner sketch description. Students need this language to identify body-reference points, talk about front and side views, describe garments on the figure, and comment on silhouette, outline, and visible design features without shifting into personal-body judgment.",
  "language_focus": [
    "body-reference vocabulary",
    "fashion figure and croquis vocabulary",
    "pose and view language",
    "The figure is ...",
    "The figure is wearing ...",
    "silhouette and outline language",
    "hem location language",
    "guided fashion-figure description writing",
    "teacher-supported sketch description speaking"
  ],
  "skill_focus": [
    "reading",
    "listening",
    "writing",
    "vocabulary",
    "speaking",
    "professional_communication",
    "visual_literacy",
    "grammar"
  ],
  "target_vocabulary_groups": [
    "m01w05-vg01",
    "m01w05-vg02",
    "m01w05-vg03",
    "m01w05-vg04",
    "m01w05-vg05"
  ],
  "grammar_focus": [
    "This is a fashion figure / sketch / croquis",
    "This is a front view / side view / back view",
    "The figure is standing / walking / sitting",
    "The pose is simple / relaxed / straight",
    "The figure is wearing ...",
    "The garment has ...",
    "The silhouette is ...",
    "The outline is ...",
    "The hem is above the knee / below the knee",
    "adjective order in simple design description",
    "articles with singular count nouns",
    "plural body-reference nouns such as shoulders and legs"
  ],
  "pronunciation_focus": [
    "figure",
    "sketch",
    "croquis",
    "outline",
    "pose",
    "proportion",
    "silhouette",
    "shoulder",
    "waist",
    "hip",
    "knee"
  ],
  "cefr_access_level": "A2",
  "cefr_target_level": "A2",
  "estimated_total_minutes": 141,
  "activity_ids": [
    "m01w05-a01",
    "m01w05-a02",
    "m01w05-a03",
    "m01w05-a04",
    "m01w05-a05",
    "m01w05-a06",
    "m01w05-a07",
    "m01w05-a08",
    "m01w05-a09"
  ],
  "asset_ids": [
    "m01w05-img-001",
    "m01w05-img-002",
    "m01w05-img-003",
    "m01w05-img-004",
    "m01w05-img-005",
    "m01w05-aud-001"
  ],
  "teacher_preparation": [
    "Preview the Week 5 opener board, the body-reference diagram, the figure-sketch vocabulary board, the labeled figure image, and the four-figure gallery before class.",
    "Prepare visible sentence frames for This is a fashion figure, The figure is, The pose is, The figure is wearing, The silhouette is, and The hem is below the knee or above the knee.",
    "Review the Week 5 correction targets, especially missing is, The figure is wearing, adjective order, and below the knee.",
    "Decide whether students will complete the Fashion Figure Description Card from a projected gallery, printed cards, or a future app gallery.",
    "Bring or project the four-figure gallery for listening, reading, writing, and the teacher speaking session."
  ],
  "student_deliverables": [
    "Completion of the Week 5 review opener.",
    "Completion of the main body and figure vocabulary matching sets.",
    "Completion of the figure-labeling task using labeled point keys.",
    "Listening-comprehension responses identifying pose, view, and garment details from one audio clip.",
    "Reading-comprehension responses matching sketch captions to visible figure images.",
    "Completion of controlled phrase-practice frames for fashion-figure description.",
    "A scaffolded Fashion Figure Description Card with 5 to 6 required sentence-frame lines and 1 optional challenge line.",
    "One corrected Week 5 sentence saved after review.",
    "A short teacher-observed oral sketch description using prepared sentence frames."
  ]
}
