{
  "week_id": "m01w04",
  "module_id": "module-01",
  "week_number": 4,
  "title": "Parts of a Garment",
  "summary": "Students build from Week 3 garment names into garment-part vocabulary and detail-focused description. They identify visible parts on garments, label details on images, understand short spoken and written detail descriptions, practice A2 phrase frames such as It has and There is or There are, and produce a scaffolded Garment Details Card.",
  "essential_question": "How can I identify and explain visible garment parts in simple English for Fashion Design study?",
  "professional_context": "Week 4 connects English to the visible details Fashion Design students notice in drawing, sewing, patternmaking, garment observation, technical description, and simple critique. Students need this language to label what they see and explain where a detail is and why it matters.",
  "language_focus": [
    "garment-part vocabulary",
    "visual labeling",
    "detail-focused listening",
    "It has and They have",
    "There is and There are",
    "location phrases for garment details",
    "guided garment-detail writing",
    "oral explanation of garment parts"
  ],
  "skill_focus": [
    "reading",
    "listening",
    "writing",
    "vocabulary",
    "speaking",
    "professional_communication",
    "visual_literacy",
    "grammar"
  ],
  "target_vocabulary_groups": [
    "m01w04-vg01",
    "m01w04-vg02",
    "m01w04-vg03",
    "m01w04-vg04",
    "m01w04-vg05"
  ],
  "grammar_focus": [
    "This is the ___",
    "These are the ___",
    "It has ___",
    "They have ___",
    "There is a ___ on the front",
    "There are ___ on the front",
    "The ___ is on the back",
    "The ___ is at the top",
    "The ___ is at the bottom",
    "The ___ is near the hem",
    "singular and plural detail nouns",
    "articles with singular garment parts"
  ],
  "pronunciation_focus": [
    "collar",
    "neckline",
    "sleeve",
    "cuff",
    "shoulder",
    "pocket",
    "zipper",
    "button",
    "waistband",
    "hem",
    "seam",
    "lining"
  ],
  "cefr_access_level": "A2",
  "cefr_target_level": "A2",
  "estimated_total_minutes": 129,
  "activity_ids": [
    "m01w04-a01",
    "m01w04-a02",
    "m01w04-a03",
    "m01w04-a04",
    "m01w04-a05",
    "m01w04-a06",
    "m01w04-a07",
    "m01w04-a08"
  ],
  "asset_ids": [
    "m01w04-img-001",
    "m01w04-img-002",
    "m01w04-img-003",
    "m01w04-img-004",
    "m01w04-img-005",
    "m01w04-aud-001"
  ],
  "teacher_preparation": [
    "Preview the Week 4 garment-detail overview board, the two vocabulary boards, the labeled garment image, and the listening script before class.",
    "Prepare visible sentence frames for It has, They have, There is, There are, on the front, on the back, at the top, at the bottom, and near the hem.",
    "Review the Week 4 correction targets, especially missing articles, singular and plural detail nouns, and on versus at in location phrases.",
    "Decide whether students will build the Garment Details Card from a projected garment gallery, printed cards, or a future app gallery.",
    "Bring or project garment-detail image cards for the teacher-led pronunciation, labeling warm-up, and speaking session."
  ],
  "student_deliverables": [
    "Completion of the Week 4 opener and detail-recognition task.",
    "Completion of the main garment-parts vocabulary matching sets.",
    "Reading and visual-labeling responses about one garment image.",
    "Listening-comprehension responses identifying garments, details, and locations from short spoken descriptions.",
    "Completion of phrase-practice items using It has, There is, There are, and location phrases.",
    "A scaffolded Garment Details Card with 5 to 6 required sentence-frame lines and one optional challenge line.",
    "One corrected Week 4 sentence saved after review.",
    "A short teacher-observed oral explanation of one garment and its visible details."
  ]
}
